sector,lever,index,limit,today,interaction,level1,level2,level3,level4
Demographics,How many of us will there be?,0,3,"In 2010 the world's population was around 6.9 billion.  We expect our population to grow, but don't know how much by. According to the UN, by 2050 it could be:",We aren't advocating population control. Just pointing out that we need to be ready for the consequences of different populations. Take a look at what happens to the consequences box as you click on the different population levels.,10.9 billion,9.6 billion,8.3 billion,
Demographics,How many of us will live in cities?,1,3,"In 2010, 52% of the world's population lived in urban areas. We expect the number of people in urban areas to grow, but don't know how much by. By 2050 it could reach:","For comparison, about 80% of people in North America live in urban areas today, about 70% in Europe and about 40% in Africa and Asia. ",75%,65%,58%,This lever only has three levels
Lifestyle,How far will we travel?,2,4,"In 2011, the average distance travelled per person was around 7,500 km/year. We expect it to grow. By 2050 it could reach:","The average distance travelled per person today is roughly 10-12,000 km/yr in North America, closer to 6,000 km/yr in Europe and more like 1,500 km/yr in many developing countries.","21,000 km/year ?!","17,000 km/yr ?!","15,000 km/yr ?!","11,000 km/yr ?!"
Lifestyle,How big will our homes be?,7,4,In 2011 the average urban household had 92 square metres of floor area. In 2050 it could be:,"The US and Austria have an average residential building size of 200 square meters, and Hong Kong has an average size of 45 square meters.",110 m<sup>2</sup>/household,105 m<sup>2</sup>/household,105 m<sup>2</sup>/household,95 m<sup>2</sup>/household
Lifestyle,How comfortable will our homes be?,8,4,In 2011 the average urban house temparture ranged from 17.5&deg;C in winter to 26&deg;C in summer. Hot water demand was about 18000 literes per y per person. In 2050 it could be:,Rural and non-residential buildings are typically colder in winter and hotter in summer than urban homes.,20&ndash;24&deg;C and 22000 litres of hot water per year per person,19&ndash;25&deg;C and 20000 litres of hot water per year per person,18&ndash;26&deg;C and 18000 litres of hot water per year per person.,17&ndash;27&deg;C and 15000 litres of hot water per year per person.
Lifestyle,How many appliances will we have in our homes?,9,4,"In 2011 the average urban household owns 1 refrigerator, 0.3 dishwashers, 0.8 clothes washers, 0.3 clothes dryers, 1.6 TV and owns 20 light bulbs. In 2050 it could have:",Rural households?,"1.4 refrigerators, 0.5 dishwashers, 1.2 clothes washers, 0.4 clothes dryers, 2.4 TVs and 40 light bulbs.","1.1 refrigerators, 0.4 dishwashers, 0.9 clothes washers, 0.3 clothes dryers, 2 TVs, and 35 light bulbs.","1 refrigerator, 0.3 dishwasher, 0.8 clothes washer, 0.3 clothes dryer, 1.6 TV, and 30 bulbs.","0.8 refrigerators, 0.3 dishwashers, 0.6 clothes washers, 0.2 clothes dryers, 1.3 TVs and 25 light bulbs."
Lifestyle,How much food will we eat?,30,4,"In 2011, the global average food consumption was 2140 kcal/person/day. In 2050 it could be:",The average disguises extremes of obesity and undernourishment.,2520 kcal/person/day (typical for Europe),2400 kcal/person/day (recent trends continue),2300 kcal/person/day (long term trends continue),2100 kcal/person/day (the target for a healthy diet)
Lifestyle,How much meat will we eat?,31,4,The current global average meat consumption is 212 kcal of meat/person/day. In 2050 it could be: ,,309 kcal/person/day (typical for Europe),212 kcal/person/day (as today),162 kcal/person/day (WHO reference for a healthy diet),15 kcal/person/day (akin to India in 2011)
Lifestyle,How much stuff will we buy?,13,4,"We produce of 8.4 billion tonnes of materials (steel, cement, chemicals etc) each year. In 2050 it could be:",Need some per capita numbers here!,Tonnes per person grows with GDP. No improvement in recycling or reuse.,Tonnes per person stabilises at the EU level. Products last a little longer. Some increase in reuse and recycling.,Product demand per person stable at today's level. Produces last longer. Recylcing and ruse increases significantly.,Fewer prodcuts per person than today. Products last 30% longer. 
Efficiency,How far will our stuff travel?,3,4,In 2011 65 trillion tonne-km of freight were moved globally. In 2050 it could be:,Convert this to km? with tonnes driven by industry?,156 trillion tonne-kms,130 trillion tonne-kms,117 trillion tonne-kms,91 trillion tonne-kms
Efficiency,"Do we use cars, or public transport?",4,4,"In 2011, about 40% of kilometers travelled were by car. The rest is by foot, motorcycle, bicycle or public transport. In 2050 it could be:","In 2011, between 60 and 80% of distance travelled was by car in developed countries. For developing countries, this number is often less than 20%.",65% of km travelled are by car.,50% of km traveled are by car. ,40% of km travelled are by car.,30% of km travelled are by car.
Efficiency,How efficienct will our vehicles be?,5,4,In 2011 cars had an efficiency of about 10 litres/100km. A modern Toyota Prius can achieve about 4 litres/100 km. By 2050 the average efficiency could be:,This choice also affects the efficiency of other types of vehicle in a similar way.,8 liters/100km,7 litres/100km,5 litres/100km,3 litres/100km
Efficiency,How insulated will our buildings be?,10,4,"In 2011, on average, 1.5 W of heat flows through building walls, per m<sup>2</sup> of floor area per &deg;C of temperature difference between inside and out. Better design and insulation means that by 2050 the flow of heat could be:",,1.2 W/m<sup>2</sup>&deg;C (20% better),0.9 W/m<sup>2</sup>&deg;C (40% better),0.6 W/m<sup>2</sup>&deg;C (60% better),0.4 W/m<sup>2</sup>&deg;C (73% better)
Efficiency,How efficient will our appliances be?,12,4,"In 2011, the rate at which appliances used energy was on average: refrigerator 100W, dishwasher 1500W, clothes washer 700W, clothes dryer 1500W, TV 250W, miscellaneous appliances 100W. In 2050 it could be:",,Improved by 20%,Improved by 35%,Improved by 50%,Improved by 65%
Efficiency,How efficiently will we use materials?,14,4,Demand for products leads to the production of 8.4Gt of materials. By 2050:,"This choice also includes increasing action on recycling, and increasing action on replacing energy intensive materials with less intensive alternatives.",No change from today,10% less material is used to make a given product. ,20% less materialis used to make a given product.,30% less material to make a given product.
Efficiency,How efficient will our power stations be?,21,4,"In 2011, on 25% of coal power stations were using the most efficient technologies (ultra- or super- critical). By 2050 the proportion could be:",This choice also includes similar assumptions about increasing efficeincy of gas and oil power stations.,37% of coal power stations are using the most efficient technologies.,45% of coal power stations are using the most efficient technologies.,49% of coal power stations are using the most efficient technologies.,55% of coal power stations are using the most efficient technologies.
Fuel type,Will we use electric & hydrogen powered vehicles?,6,4,"In 2011, less than 1% of passenger cars are electric or hydrogen powered. By 2050 it could be:",How are 2 wheeler's counted?,2%,10%,45%,55%
Fuel type,How will we heat and cool our buildings?,11,4,"In 2011 heating was 55% by gas boiler, 17% by district heating, 2% by heat pumps with the remainder by a mixture of other technologies. Cooling structure was 100% by air-conditioning.","This choice also includes similar assumptions about shifting to electric cooking, and shifting to LED lighting.","HEATING: 2% heat pumps, 17% district heating.<br/>COOLING: 93% air conditioners, 2% chillers, 5% solar cooling.","HEATING: 4% heat pumps, 55% district heating. <br/>COOLING 85% air-conditioning 5% chiller, 10% solar cooling.","HEATING 15% heat pumps, 10% district heating.<br/>COOLING 75% air-conditioning 10% chiller, 15% solar cooling. ","HEATING:40% heat pumps, 8% district heating.<br/>COOLING: 65% air-conditioning 15% chiller, 20% solar cooling. "
Manufacturing,"Iron, steel & aluminium",15,4,Specific emissions (GtCO2 per Gt of materials) for steel of 2 and for aluminium of 0.9.,/,"Continued use of  current processes & technologies.Continued use of fuels.Minimal improvements in Energy efficiency.Emissions per ton increase by 0% for steel & 0% for aluminium.","Moderate decrease in classic blast oxygen furnaces, increase in Electric Arc furnaces and new oxygen furnace technologies. Moderate improvements in aluminium.Equivalent to the development of recent programs for some sectors.Emissions per ton decrease by 2% for steel and by 3% for aluminium.","Significant technology progress, fuel switch towards biomass & electrification)  & energy efficiency requiring important financial investments.Emissions per ton decrease by 1% for steel & by 7% for aluminium.","Very important technology progress, fuel switch (towards biomass & electrification) & energy efficiency close to technical and physical constraints (but limited breakthrough technologies).Emissions per ton decrease by 1% for steel& by 13% for aluminium."
Manufacturing,Chemicals,16,4,Specific emissions for chemicals of 1.7GtCO2 per Gt of materials,,"Continued use of current processes & technologiesContinued use of fuelsMinimal improvements in energy efficiencyEmissions per ton increase by 1% for chemicals","Moderate technology progress, fuel changes and energy efficiency.Equivalent to the development of recent programs for some sectors.Emissions per ton decrease by 3%.","Significant technology progress, fuel switch towards biomass & electrification)  & energy efficiency requiring important financial investments. Emissions per ton decrease by 7%","Very important technology progress, fuel switch (towards biomass & electrification) & energy efficiency close to technical and physical constraints (but limited breakthrough technologies). Emissions per ton decrease by 15%"
Manufacturing,Paper and other,17,4,Specific emissions (GtCO2 per Gt of materials) for pulp & paper of 0.5 and for other materials of 2.2.,,"Continued use of  current processes & technologiesContinued use of fuelsMinimal improvements in energy efficiencyEmissions per ton increase by 1% for Paper and 2% for others materials","Moderate technology progress, fuel changes and energy efficiency.Equivalent to the development of recent programs for some sectors.Emissions per ton decrease by 20% for pulp & paper & by 20 % for other materials.","Significant technology progress, fuel switch towards biomass & electrification)  & energy efficiency requiring important financial investmentsEmissions per ton decrease by 32% for pulp & paper, and by 31% for other materials","Very important technology progress, fuel switch (towards biomass & electrification) & energy efficiency close to technical and physical constraints (but limited breakthrough technologies).Emissions per ton reduce by 45% for pulp & paper, and by 42% for other materials."
Manufacturing,Cement,18,4,Specific emissions for cement of 0.6GtCO2 per Gt of materials,,"Continued use of  current processes & technologies (28% clinker in cement).Continued use of fuelsMinimal improvements in Energy efficiencyEmissions per ton decrease by 2% for cement","Moderate technology progress (31% clinker in cement), fuel changes and energy efficiency.Equivalent to the development of recent programs for some sectors.Emissions per ton decrease by 4%.","Significant technology progress (34% clinker in cement), fuel switch towards biomass & electrification)  & energy efficiency requiring important financial investmentsEmissions per ton decrease by 8%","Very important technology progress (90% clinker in cement), fuel switch (towards biomass & electrification) & energy efficiency close to technical and physical constraints (but limited breakthrough technologies).Emissions per ton reduce by 31%."
Manufacturing,Carbon capture and storage (ind.),19,4,CCS is not implemented in industry in 2011.,/,No CCS development,Partial CCS development as of 2030 progressively leading to a reduction of 18% of emissions . It also implies a 1 EJ additional electricity consumption per GtCO2 captured.,Important CCS development as of 2030 progressively leading to a reduction of 39% of emissions. It also implies a 1 EJ additional electricity consumption per GtCO2 captured.,Very important CCS development as of 2030 progressively leading to a reduction of 70% of emissions. It also implies a 1 EJ additional electricity consumption per GtCO2 captured.
Electricity,Do we make electricity from coal or gas?,20,4,"In 2011 out of total power supplied by fossil fuels 60% was supplied by solid fuel (coal / biomass), 9% by liquid fuel and 31% by gas fuel","If the user supplies bioenergy from the land and food choices, some of this is allocated to thermal power plants","By 2050, out of total electricity from fossil fuel / bioenergy based power,  58% is solid, 29% liquid and 13% is gas-based power","By 2050, out of total electricity from fossil fuel / bioenergy based power, 40% is solid, 19% of liquid and 41% of gas-based power","By 2050, out of total electricity from fossil fuel / bioenergy based power, 32% is solid, 6% is liquid and 62% is gas-based power","By 2050, out of total electricity from fossil fuel / bioenergy based power, 26% is solid, 2% is liquid and 72% is gas-based power"
Electricity,Do we use Carbon Capture and Storage?,22,4,"In 2011, most of the CCS projects implemented in the power sector were demonstration projects of kW and MW scale. There was no commercial  deployment of CCS in power in 2011. However, there is a pipeline of CCS projects being developed by OECD countries (mainly USA and EU). These are not expected until the early 2020s.",,By 2050 there is 16 GW of CCS installed power capacity,By 2050 there is 490 GW of CCS installed power capacity,By 2050 there is 1487 GW of CCS installed power capacity,By 2050 there is 3700 GW of CCS installed power capacity
Electricity,Do we use nuclear power?,23,4,In 2011 the total installed nuclear capacity was 369 GW with 429 operational power plants around the world,,By 2050 there is 0 GW of installed nuclear power capacity.,By 2050 there is 558 GW of installed nuclear power capacity.,By 2050 there is 989 GW of installed nuclear power capacity.,By 2050 there is 1870 GW of installed nuclear power capacity.
Electricity,Do we use wind power?,24,4,In 2011 there was around 238 GW of onshore wind capacity with 83 countries across globe deploying it. In 2011 there was also 3.8 GW of offshore power installed.,,By 2050 there is 0 GW of installed wind power capacity,By 2050 there is 2317 GW of installed wind power capacity.,By 2050 there is 4710 GW of installed wind power capacity.,By 2050 there is 6466 GW of installed wind power capacity
Electricity,Do we use hydroelectric power?,25,4,In 2011 the total installed hydro capacity was 970 GW ,,By 2050 there is 1324 GW of installed hydro power capacity.,By 2050 there is 1697 GW of installed hydro power capacity.,By 2050 there is 1912 GW of installed hydro power capacity.,By 2050 there is 2342 GW of installed hydro power capacity.
Electricity,Do we use wave and tidal power?,26,4,"In 2011, there was around 1 GW of tidal power and 0.01 GW of wave energy.",,By 2050 there is 8 GW of installed marine power capacity,By 2050 there is 97 GW of installed marine power capacity,By 2050 there is 237 GW of installed marine power capacity,By 2050 there is 435.6 GW of installed marine power capacity
Electricity,Do we use solar power?,27,4,"In 2011, there was around 1.59 GW of concentrated solar power and 28 GW of photovoltaic power.",,By 2050 there is 0 GW of installed solar power capacity,By 2050 there is 1199 GW of installed solar power capacity,By 2050 there is 3854 GW of installed solar power capacity,By 2050 there is 7547 GW of installed solar power capacity
Electricity,Do we use geothermal power?,28,4,"In 2011, there was around 11.56 GW of geothermal power. Around 24 countries used geothermal electricity and 70 countries geothermal heat. Maximum potential lies in countries on the ""ring of fire"" (in the basin of the Pacific Ocean).",,By 2050 there is 0 GW of installed geothermal power capacity,By 2050 there is 172 GW of installed geothermal power capacity,By 2050 there is 289 GW of installed geothermal power capacity,By 2050 there is 404 GW of installed geothermal power capacity
Land,How efficiently do we use our land?,33,4,"""Land-use efficiency"" is the use of land for multiple purposes (e.g. co cropping and integration schemes). It can decrease land area needed but can also result in negative effects.",,Mismanaged land use. It assumes that 10% more agricultural land would be necessary to attain the selected food/livestock/bioenergy productions.,Current world pattern of agricultural system stabilised until 2050 (no change from 2011),10% less agricultural land is necessary to attain the selected food/livestock/bioenergy productions by 2050. ,30% less agricultural land would be necessary to attend the selected food/livestock/bioenergy productions by 2050.
Land,Do crop yields increase?,32,4,"Crop yields are substantially increasing, particularly in the developing countries where there is a significant productivity gap with those counties with higher yields.",,"Negative crop yields, which could be interpreted as due to climate change impacts on agriculture (yields fall 10% by 2050).",Moderate crop yield growth (40% increase from 2011 by 2050).,High crop yield growth (60% increase from 2011 by 2050).,High crop yield growth (120% increase from 2011 by 2050)
Land,Do livestock yields increase?,34,4,"Gradual annual increases in livestock yields worldwide, with a significant yield gap in developing countries and extensive production systems. ",,"Low increase of livestock yields: 10% increase in concentration of grass-fed livestock (animal density), 5% increase of feed conversion ratio, and no increase in feedlot systems by 2050. ","Moderate increase of livestock yields: 30% increase in concentration of grass-fed livestock (animal density), 10% increase of feed conversion ratio, and low increase in feedlot systems from 2% in 2011 to 5% in 2050 for cattle and from 4% in 2011 to 6% in 2050 for sheep and goats.","High increase of livestock yields: 50% increase in concentration of grass-fed livestock (animal density), 15% increase of feed conversion ratio, and moderate increase in feedlot systems from 2% in 2011 to 15% in 2050 for cattle and from 4% in 2011 to 8% in 2050 for sheep and goats. ","Assumes a high increase of livestock yields: 80% increase in concentration of grass-fed livestock (animal density), 20% increase of feed conversion ratio, and high increase in feedlot systems from 2% in 2011 to 30% in 2050 for cattle and from 4% in 2011 to 10% in 2050 for sheep and goats."
Land,Do bioenergy yields increase?,35,4,"Bioenergy represents approximately 60 EJ of the world energy mix (2011). Production is most substantial in EUA, Brazil, Germany, France and China, and others. Bioenergy is mostly produced as a biofuel for the transport sector. Solid biomass is used mainly for cooking and heating, but could have a larger role in displacing coal in thermopower plants. Negative emissions can be possible if bioenergy is used with carbon capture and storage (BECCS). Bioenergy also has a speculative use as a greenhouse gas removal technology in the form of biochar (see the GGR tab).",,"Means a low yield increase of energy production per area, without significant changes in the energy crop mix. Total increase: 20% by 2050.",Assumes a moderate increase in energy crop yields and changes in the mix of energy crops towards a higher share of energy efficient plants. Total increase 50% by 2050.,"Means a high yield increase, and substantial changes in their mix towards high energy efficient plants. Total increase 120% by 2050. ","Represents an extreme increase of bioenergy yields, and use of very high efficient crops. Total increase: 220% by 2050. "
Land,Do we use spare land for growing forests? or growing biocrops?,36,4,"In 2011, there was around 6 million ha of deforestation, not only due to livestock and agricultural expansions, but also to wood extraction and land tenure issues. ",,"Surplus land will be subject to 80% forests (including natural regeneration and planted forests), and 20% degrated lands and restoration of grasslands.","Surplus land would be allocated for 60% natural regeneration and planted forests, and 40% for a limmited expansion of energy crops.","Surplus land would be allocated for 40% natural regeneration and planted forests, and 60% for a limited expansion of energy crops.","Surplus land would be allocated 100% for a limited expansion of energy crops. If there is still land available, such land will be allocated as natural restoration and planted forests."
Land,Do we exploit wastes and residues?,42,4,"Susbtantial production of wastes and residues worldwide with a low collection of them for energy and animal feed purposes. Total on-farm residues are equivalent to 100% of the total food production, which includes straws, stoves and husks, with approximately 10% currently collected for energy or feed. As for the post-farm residues and wastes, it is estimated that 25% of the total food production and 10% of meat products, milk and eggs become losses, with the collection for energy and feed of only 1% of food and meat, 0.1% of milk (derivates) and 0.2% eggs (mostly derivates) out ot this total production. Note that all these values are in energy terms.  ",,"Assumes no increase in the production and collection of on-farm residues; and no increase in the production of post-farm wastes and residues, but with a low increase in their collection for energy and feed. ",Moderate increase in the collection of on-farm residues (from 10% in 2011 to 20% in 2050). It also assumes a reduction in the production of post-farm residues and wastes (crop-based food waste decreasing from 25% in 2011 to 20% in 2050) and moderate increase in collection for energy and feed.    ,High collection of on-farm residues for energy and feed (from 10% in 2011 to 30% in 2050). Reduction in the production of post-farm wastes and residues (crop-based food waste decreasing from 25% in 2011 to 15% in 2050). Increase in waste collection for bioenergy.,Extreme collection of on-farm residues for energy and feed (from 10% in 2011 to 40% in 2050). A substantial reduction in the production of post-farm wastes and residues (crop-based food waste decreasing from 25% in 2011 to 10% in 2050). An increase in waste collection for bioenergy.
Speculative technologies,Do we use biochar?,37,4,Biochar is already routinely produced on a large scale for use as charcoal and as a soil improver. What is less well-established is the long-term characterisation of the behaviour of biochar as a means of storing carbon away from the atmosphere. ,,No biochar technologies. This assumes that biochar will not be implemented by 2050 at any scale,Low effort on biochar technologies. Such technologies would not require additional technological advances or changes in regulation. The removal rate would reach 0.33 GtCO2/year by 2050 (10% of level 4).,Substantial contribution of biochar to tackle global warming. It would require technical and regulatory advances. The removal rate would reach 0.825 GtCO2/year by 2050 (25% of level 4).,"Top estimate of how much biochar could contribute by 2050. It is highly unlikely that emissions could be removed at this level in this timeframe, and the pathway carries significant risks. The removal rate would reach 3.3 GtCO2/year by 2050."
Speculative technologies,Do we capture CO2 directly from the air?,38,4,"There are about a dozen proposed DAC technologies that have been demonstrated at small scales. Technically the process works – in fact, the removal of carbon dioxide from ambient air in submarines and spacecraft has been practised for decades. The real questions are around the carbon balance of the systems and the economics.",,No direct air capture technologies. This assumes that they will not be implemented by 2050 at any scale.,Low effort on DAC technologies. Such technologies would not require additional technological advances or changes in regulation. The removal rate would reach 1 GtCO2/year by 2050 (10% of level 4).,Substantial contribution of DAC to tackle global warming. It would require technical and regulatory advances. The removal rate would reach 2.5 GtCO2/year by 2050 (25% of level 4).,"Top estimate of how much DAC could contribute by 2050. It is highly unlikely that emissions could be removed at this level in this timeframe, and the pathway carries significant risks. The removal rate would reach 10 GtCO2/year by 2050."
