sector,lever,index,limit,today,interaction,level1,level2,level3,level4
Speculative technologies,Do we fertilise the oceans?,39,4,"A small number of OF experiments have been undertaken, most with the approval of national research establishments, but some without such approval. Those experiments that have been undertaken without approval have been highly controversial. The results of the officially approved experiments have indicated, at least in some instances, that there has been net carbon drawdown, but there are still many unanswered questions as to the long-term effects of this technique. ",,No OF technologies. It means that they will not be implemented by 2050 at any scale.,Low effort on OF technologies. Such technologies would not require additional technological advances or changes in regulation. The removal rate would reach 0.1 GtCO2/year by 2050 (10% of level 4).,Substantial contribution of OF to tackle global warming. It would also require technical and regulatory advances. The removal rate would reach 0.25 GtCO2/year by 2050 (25% of level 4).,"Top estimate of how much OF could contribute by 2050. It is highly unlikely that emissions could be removed at this level in this timeframe, and the pathway carries significant risks. The removal rate would reach 1 GtCO2/year by 2050."
Speculative technologies,Do we increase the rate of weathering in the oceans?,40,4,"EW-O has been studied in the laboratory and has been modelled, but it has not been researched in the open environment. The processes required to generate alkaline materials are well established at an industrial scale. However, the environmental impacts of adding them into the oceans are not known. ",,No ocean-based EW-O technologies. This assumes that they will not be implemented by 2050 at any scale.,Low effort on EW-O technologies. Such technologies would not require additional technological advances or changes in regulation. The removal rate would reach 1 GtCO2/year by 2050 (10% of level 4).,Substantial contribution of EW-O to tackle global warming. This would require technical and regulatory advances. The removal rate would reach 2.5 GtCO2/year by 2050 (25% of level 4).,"Top estimate of how much EW-O could contribute by 2050. It is highly unlikely that emissions could be removed at this level in this timeframe, and the pathway carries significant risks. The removal rate would reach 10 GtCO2/year by 2050."
Speculative technologies,Do we increase the rate of weathering on land?,41,4,"EW-T has been studied in the laboratory and has been modelled, but it has had little research in the open environment (though proponents of EW-T have marketed ground olivine as a soil additive already). Technical and theoretical modelling of the particle sizes indicate that while there would be some carbon dioxide drawdown, it is far less than has been claimed. ",,No land-based EW-T technologies. It means that they will not be implemented by 2050 at any scale.,Low effort on EW-T technologies. Such technologies would not require additional technological advances or changes in regulation. The removal rate would reach 0.37 GtCO2/year by 2050 (10% of level 4).,Substantial contribution of EW-T to tackle global warming. It would require technical and regulatory advances. The removal rate would reach 0.925 GtCO2/year by 2050 (25% of level 4).,"Top estimate of how much EW-T could contribute by 2050. It is highly unlikely that emissions could be removed at this level in this timeframe, and the pathway carries significant risks. The removal rate would reach 3.7 GtCO2/year by 2050."
Climate science,What happens to emissions after 2050?,43,4,,,"After 2050, emissions are flat","After 2050, emissions change every year by one third of the average yearly change for the previous 15 year period (unless an absolute lower limit is hit)","After 2050, emissions change every year by two thirds the average yearly change for the previous 15 year period (unless an absolute lower limit is hit)","After 2050, emissions change every year by 1.03 x average yearly change for the previous 15 year period (unless an absolute lower limit is hit)"
Climate science,What proportion of CO2 stays in the air?,44,4,Current fraction of CO2 emissions which remain in the atmosphere: measured at 44±6 %  (IPCC AR5),,"Land and ocean sinks increase; by 2100, only 30% of emitted CO2 remains in atmosphere", Land and ocean sinks remain similar to today; 44% of emitted CO2 remains in atmosphere.,"Land and ocean sinks decrease slightly; by 2100, 60% of emitted CO2 remains in atmosphere.","Land and ocean sinks decrease significantly: by 2100, 74% of emitted CO2 remains in atmosphere."
Climate science,How confident are we in climate models?,45,B,Various methods are used to account for the fact that numerical models cannot represent the full range of our uncertainty about the future climate.,,Show only the raw range of output from climate models.,"Generate an uncertainty range based on model output, using a method similar to the most recent IPCC report, to account for unmodelled phenomena.",Low confidence in climate models.  Show alternative evidence for climate impacts.,